name,addr_1,addr_2,borough,village,post_code,z_score,counts
BRISDOC HEALTHCARE SERVICES OOH,KNOWLE WEST HEALTH PARK,DOWNTON ROAD  KNOWLE,BRISTOL,,BS4 1WH,6.1505817490838295,60.0
HMR BARDOC OOH,MOORGATE PRIMARY CARE CTR,22 DERBY ROAD,BURY,LANCASHIRE,BL9 0NJ,4.958866438487605,321.0
INTEGRATED CARE 24 LTD (CWSX OOH),KINGSTON HOUSE,THE LONG BARROW,ASHFORD,KENT,TN24 0GP,4.8888781604828235,426.0
DARWEN HEALTHCARE,DARWEN HEALTH CENTRE,JAMES STREET WEST,DARWEN,LANCASHIRE,BB3 1PY,4.8391589686363385,1917.0
THE LIMES MEDICAL PRACTICE,THE LIMES MEDICAL CENTRE,8-12 HODGE ROAD  WALKDEN,WORSLEY,MANCHESTER,M28 3AT,4.546841872334426,1321.0
IC24 LTD (BRIGHTON & HOVE OOH),IC24 LTD  KINGSTON HOUSE,THE LONG BARROW,ASHFORD,KENT,TN24 0GP,4.335047010605197,357.0
OLDHAM 7 DAY ACCESS HUB2 OOH,ROYTON H/WB CTR  PARK ST,ROYTON,OLDHAM,,OL2 6QW,4.31178403661019,56.0
IC24 LTD (NORFOLK & WISBECH OOH),IC24 LTD  KINGSTON HOUSE,THE LONG BARROW,ASHFORD,KENT,TN24 0GP,4.2575005924727645,489.0
BURY WALK-IN CENTRE,MOORGATE PRIMARY,CARE CENTRE 22 DERBY WAY,BURY,,BL9 0NJ,4.150589122881536,138.0
